{
  "version": 1,
  "generated_at": "2026-07-17T23:13:16Z",
  "source_root": "/Users/mikhail/.agents/skills",
  "skills": [
    {
      "name": "agent-delegation",
      "path": "skills/agent-delegation/SKILL.md",
      "description": "Delegate work to another coding agent or configured adapter.",
      "category": "utility",
      "priority": "utility",
      "tokens": {
        "frontmatter_chars": 98,
        "skill_chars": 1199
      }
    },
    {
      "name": "architecture-decision-records",
      "path": "skills/architecture-decision-records/SKILL.md",
      "description": "Record architectural decisions as ADRs during development.",
      "category": "utility",
      "priority": "utility",
      "tokens": {
        "frontmatter_chars": 119,
        "skill_chars": 1472
      }
    },
    {
      "name": "backend-architecture",
      "path": "skills/backend-architecture/SKILL.md",
      "description": "Backend design patterns, API design, database schemas, auth, and observability.",
      "category": "web",
      "priority": "primary",
      "tokens": {
        "frontmatter_chars": 119,
        "skill_chars": 1861
      }
    },
    {
      "name": "cartographer",
      "path": "skills/cartographer/SKILL.md",
      "description": "Map a codebase into CODEBASE_MAP with module boundaries and navigation paths.",
      "category": "utility",
      "priority": "utility",
      "tokens": {
        "frontmatter_chars": 111,
        "skill_chars": 1171
      }
    },
    {
      "name": "continuous-learning-v2",
      "path": "skills/continuous-learning-v2/SKILL.md",
      "description": "Maintain project-scoped learning observations, instincts, and memory.",
      "category": "utility",
      "priority": "utility",
      "tokens": {
        "frontmatter_chars": 138,
        "skill_chars": 1747
      }
    },
    {
      "name": "create-mwhs-khutbah",
      "path": "skills/create-mwhs-khutbah/SKILL.md",
      "description": "Create and manage khutbahs on the MWHS (mwhs.org.uk) admin dashboard using a macOS native dialog for credentials and the admin API via session cookie.",
      "category": "utility",
      "priority": "utility",
      "tokens": {
        "frontmatter_chars": 232,
        "skill_chars": 2177
      }
    },
    {
      "name": "create-pi-package",
      "path": "skills/create-pi-package/SKILL.md",
      "description": "Create, test, and optionally publish Pi packages containing extensions, skills, prompt templates, or themes. Use when the user says make a Pi package, bundle Pi resources, publish to pi.dev/packages, or invokes /skill:create-pi-package.",
      "category": "utility",
      "priority": "utility",
      "tokens": {
        "frontmatter_chars": 273,
        "skill_chars": 2042
      }
    },
    {
      "name": "dead-code-detector",
      "path": "skills/dead-code-detector/SKILL.md",
      "description": "Scan codebases for dead/unused code \u2014 functions, types, imports, variables, exports, files \u2014 with language-aware heuristics, confidence levels, and safe reporting. No deletion without explicit approval.",
      "category": "utility",
      "priority": "utility",
      "tokens": {
        "frontmatter_chars": 377,
        "skill_chars": 1623
      }
    },
    {
      "name": "decision-capture",
      "path": "skills/decision-capture/SKILL.md",
      "description": "Extract project vision, preferences, constraints, and decisions from the user into README, docs, or ADRs through a short Q&A loop. Use when the user says brain-to-docs, extract the vision, document this project, capture decisions, or build out the docs.",
      "category": "thinking",
      "priority": "utility",
      "tokens": {
        "frontmatter_chars": 350,
        "skill_chars": 1561
      }
    },
    {
      "name": "design-md-gallery",
      "path": "skills/design-md-gallery/SKILL.md",
      "description": "Secondary product visual-language reference only after frontend-design: match or borrow from known brands in the DESIGN.md gallery. Do not use alone; pair after frontend-design for greenfield or redesign polish.",
      "category": "design",
      "priority": "secondary",
      "tokens": {
        "frontmatter_chars": 250,
        "skill_chars": 1301
      }
    },
    {
      "name": "design-systems-reference",
      "path": "skills/design-systems-reference/SKILL.md",
      "description": "Secondary design reference only after frontend-design: design system tokens, component APIs, accessibility patterns, and licensing. Do not use alone for new UI; load for component libraries, docs, and a11y checks after frontend-design.",
      "category": "design",
      "priority": "secondary",
      "tokens": {
        "frontmatter_chars": 281,
        "skill_chars": 1426
      }
    },
    {
      "name": "ditto-clone",
      "path": "skills/ditto-clone/SKILL.md",
      "description": "Full-clone a public website into a runnable app via local Ditto. Use when the user asks to clone a site, recreate a page with near-parity code, or produce a Ditto app from a URL. Different from extract-design-md because this emits a runnable app, not only DESIGN.md.",
      "category": "utility",
      "priority": "utility",
      "tokens": {
        "frontmatter_chars": 297,
        "skill_chars": 1619
      }
    },
    {
      "name": "effective-agent-skills",
      "path": "skills/effective-agent-skills/SKILL.md",
      "description": "Create, edit, review, or audit agent skills. Use for new/update skill work, SKILL.md review, skill not triggering, or skill stocktake/audit.",
      "category": "triggered",
      "priority": "reference",
      "tokens": {
        "frontmatter_chars": 184,
        "skill_chars": 2044
      }
    },
    {
      "name": "electron-app-release",
      "path": "skills/electron-app-release/SKILL.md",
      "description": "Build, notarize, and publish Electron app releases for macOS (arm64 + x64) and Windows (arm64). Create GitHub releases, upload artifacts, and update website auto-update metadata. Use when the user says \"rebuild\", \"new release\", \"bump version\", \"deploy\", \"dist\", or wants to publish a new version.",
      "category": "utility",
      "priority": "utility",
      "tokens": {
        "frontmatter_chars": 336,
        "skill_chars": 2302
      }
    },
    {
      "name": "eval-harness",
      "path": "skills/eval-harness/SKILL.md",
      "description": "Local eval-driven development for agent behavior using deterministic project tests and hook fixtures.",
      "category": "utility",
      "priority": "utility",
      "tokens": {
        "frontmatter_chars": 145,
        "skill_chars": 1675
      }
    },
    {
      "name": "expo-docs",
      "path": "skills/expo-docs/SKILL.md",
      "description": "Expo documentation lookup via docs.expo.dev LLM text endpoints (llms.txt family). Use for Expo SDK/EAS/Router API facts only. For RN/Expo implementation patterns use vercel-react-native-skills; for native Swift/iOS use ios-development.",
      "category": "mobile",
      "priority": "primary",
      "tokens": {
        "frontmatter_chars": 273,
        "skill_chars": 2508
      }
    },
    {
      "name": "extract-design-md",
      "path": "skills/extract-design-md/SKILL.md",
      "description": "Extract a Stitch-compatible DESIGN.md from a public website via Ditto. Use when the user asks to extract DESIGN.md, design tokens, or an agent-readable design doc from a URL. Different from cloning because it writes only the design-system brief, not a runnable app.",
      "category": "utility",
      "priority": "utility",
      "tokens": {
        "frontmatter_chars": 302,
        "skill_chars": 1275
      }
    },
    {
      "name": "extract-mosque-pdf-vision",
      "path": "skills/extract-mosque-pdf-vision/SKILL.md",
      "description": "Extract mosque prayer timetable JSON files from a user-provided PDF using a vision model. Use when the source is a PDF/image timetable and the user wants vision extraction instead of pdftotext/OCR.",
      "category": "utility",
      "priority": "utility",
      "tokens": {
        "frontmatter_chars": 295,
        "skill_chars": 1522
      }
    },
    {
      "name": "extract-mosque-prayer-times",
      "path": "skills/extract-mosque-prayer-times/SKILL.md",
      "description": "Extract full-year structured prayer times (adhan + iqamah) from a mosque website and seed to Convex dev AND production databases. Sources: APIs/endpoints, CSV, and parseable HTML/DOM only \u2014 no PDF/image OCR and no computed/calculated times.",
      "category": "utility",
      "priority": "utility",
      "tokens": {
        "frontmatter_chars": 319,
        "skill_chars": 2664
      }
    },
    {
      "name": "fetch-tweet",
      "path": "skills/fetch-tweet/SKILL.md",
      "description": "Fetch tweet content and metadata from an X/Twitter URL.",
      "category": "utility",
      "priority": "utility",
      "tokens": {
        "frontmatter_chars": 237,
        "skill_chars": 975
      }
    },
    {
      "name": "find-skills",
      "path": "skills/find-skills/SKILL.md",
      "description": "Discover installable agent skills for a requested capability.",
      "category": "utility",
      "priority": "utility",
      "tokens": {
        "frontmatter_chars": 92,
        "skill_chars": 1148
      }
    },
    {
      "name": "frontend-design",
      "path": "skills/frontend-design/SKILL.md",
      "description": "Primary web frontend design skill for UI design, visual redesign, landing pages, typography, color, layout, motion, and polish. Use for greenfield screens, redesigns, anti-AI-slop audits, and reference-DNA studies. Pair with frontend-web-development for implementation.",
      "category": "design",
      "priority": "primary",
      "tokens": {
        "frontmatter_chars": 306,
        "skill_chars": 1924
      }
    },
    {
      "name": "frontend-web-development",
      "path": "skills/frontend-web-development/SKILL.md",